{
  "id": "reference.service_level_z_factors",
  "name": "Service-Level Safety Factors (z)",
  "description": "Standard-deviation safety factor (z) for a target cycle service level, used by the service-level safety-stock formula. Values match a standard normal distribution and the corpus safety-factor table.",
  "region": "Global",
  "effective_date": "2026-07-02",
  "review_frequency": "none (statistical constant)",
  "grounding": "corpus",
  "status": "verified",
  "source_type": "public_reference",
  "source": "Distribution Planning and Control, Table 8.4 (Table of Safety Factors)",
  "columns": ["service_level", "z"],
  "rows": [
    { "service_level": 0.5, "z": 0.0 },
    { "service_level": 0.75, "z": 0.67 },
    { "service_level": 0.8, "z": 0.84 },
    { "service_level": 0.8413, "z": 1.0 },
    { "service_level": 0.85, "z": 1.04 },
    { "service_level": 0.8944, "z": 1.25 },
    { "service_level": 0.9, "z": 1.28 },
    { "service_level": 0.9332, "z": 1.5 },
    { "service_level": 0.94, "z": 1.56 },
    { "service_level": 0.95, "z": 1.65 },
    { "service_level": 0.96, "z": 1.75 },
    { "service_level": 0.97, "z": 1.88 },
    { "service_level": 0.98, "z": 2.05 },
    { "service_level": 0.99, "z": 2.33 }
  ],
  "citations": [
    { "source_file": "376190909-Distribution-Planning-and-Control-Managing-in-the-Era-of-Supply-Chain-Management-pdf.md", "chunk_index": 480, "quote": "TABLE 8.4. Table of Safety Factors ... 95% -> 1.65, 98% -> 2.05, 99% -> 2.33." }
  ]
}
