{
  "id": "reference.freight.nmfc_classes",
  "name": "NMFC Freight Classes by Density",
  "description": "LTL freight class bands derived from shipment density (lb/ft^3). NOT in the knowledge base; the corpus references NMFC classification but contains no class table. Candidate density breaks below approximate the standard 18-class scale and MUST be confirmed against NMFTA ClassIT / NMFC.",
  "region": "US",
  "effective_date": null,
  "review_frequency": "annually (NMFTA updates; some commodities are class-fixed, not density-based)",
  "grounding": "external",
  "status": "needs_sourcing",
  "source_type": "official_standard",
  "source": "TO CONFIRM: NMFTA National Motor Freight Classification (NMFC) / ClassIT.",
  "sourcing_notes": "Density-based class is only a default; many commodities have a fixed NMFC class regardless of density, and some use density-based classification tiers. Confirm the exact density breakpoints and the 18-class list (50, 55, 60, 65, 70, 77.5, 85, 92.5, 100, 110, 125, 150, 175, 200, 250, 300, 400, 500). Label output as an estimate; advise users to confirm the commodity's actual NMFC item.",
  "columns": ["min_density_pcf", "max_density_pcf", "class", "verified"],
  "rows": [
    { "min_density_pcf": 50, "max_density_pcf": null, "class": 50, "verified": false },
    { "min_density_pcf": 35, "max_density_pcf": 50, "class": 55, "verified": false },
    { "min_density_pcf": 30, "max_density_pcf": 35, "class": 60, "verified": false },
    { "min_density_pcf": 22.5, "max_density_pcf": 30, "class": 65, "verified": false },
    { "min_density_pcf": 15, "max_density_pcf": 22.5, "class": 70, "verified": false },
    { "min_density_pcf": 13.5, "max_density_pcf": 15, "class": 77.5, "verified": false },
    { "min_density_pcf": 12, "max_density_pcf": 13.5, "class": 85, "verified": false },
    { "min_density_pcf": 10.5, "max_density_pcf": 12, "class": 92.5, "verified": false },
    { "min_density_pcf": 9, "max_density_pcf": 10.5, "class": 100, "verified": false },
    { "min_density_pcf": 8, "max_density_pcf": 9, "class": 110, "verified": false },
    { "min_density_pcf": 7, "max_density_pcf": 8, "class": 125, "verified": false },
    { "min_density_pcf": 6, "max_density_pcf": 7, "class": 150, "verified": false },
    { "min_density_pcf": 5, "max_density_pcf": 6, "class": 175, "verified": false },
    { "min_density_pcf": 4, "max_density_pcf": 5, "class": 200, "verified": false },
    { "min_density_pcf": 3, "max_density_pcf": 4, "class": 250, "verified": false },
    { "min_density_pcf": 2, "max_density_pcf": 3, "class": 300, "verified": false },
    { "min_density_pcf": 1, "max_density_pcf": 2, "class": 400, "verified": false },
    { "min_density_pcf": 0, "max_density_pcf": 1, "class": 500, "verified": false }
  ]
}
